{
  "schema_version": 1,
  "source": {
    "repo": "speeeecies",
    "rev": "locales/saopaulo-br"
  },
  "declared_tags": [],
  "entries": [
    {
      "taxon": "Abies balsamea",
      "common_name": "araucaria",
      "family": "Pinaceae",
      "archetype": "Excurrent",
      "crown_width_m": 6.2,
      "height_m": 15.0,
      "seasonal": true,
      "evergreen": true,
      "stages": ["sapling", "mature"],
      "resource_tags": ["perch", "shelter", "nest_cup"],
      "biomass_kg_per_crown_m2": null,
      "community_weight": {"saopaulo-br": 0.8},
      "native_status": {"saopaulo-br": "Native"},
      "invasive": false,
      "range": null,
      "external": {},
      "stand_in_for": "Araucaria angustifolia",
      "provenance": {
        "sources": [
          {
            "url": "https://en.wikipedia.org/wiki/Araucaria_angustifolia",
            "title": "Wikipedia contributors, \"Araucaria angustifolia\", English Wikipedia, CC BY-SA 4.0",
            "license": "CC-BY-SA-4.0",
            "accessed": "2026-10-01"
          },
          {
            "url": "https://github.com/jt55401/speeeecies/blob/main/schema/v0.1/flora-taxa.json",
            "title": "speeeecies contributors, schema/v0.1/flora-taxa.json (drawable plant models), CC BY-SA 4.0",
            "license": "CC-BY-SA-4.0",
            "accessed": "2026-10-01"
          }
        ],
        "confidence": "Low",
        "derived": true,
        "note": "Abies balsamea (balsam fir) is the drawable stand-in for Araucaria angustifolia (Parana pine / araucaria), the evergreen conifer native to the Atlantic Forest highlands of Sao Paulo, Parana, Santa Catarina and Rio Grande do Sul and the emblematic tree of the city. Growth form, evergreen flag, height_m and crown_width_m are the stand-in model's, from schema/v0.1/flora-taxa.json, so placement matches what is drawn. native_status follows the Wikipedia article on Araucaria angustifolia. community_weight is judgement: a relative share of 0.8 among the garden's trees, over the importer's 1.0 multiplier for Native plants. resource_tags are judgement, chosen to match the perch and nest_cup resources the garden's birds ask for."
      }
    },
    {
      "taxon": "Juniperus virginiana",
      "common_name": "cedro-japonês",
      "family": "Cupressaceae",
      "archetype": "Excurrent",
      "crown_width_m": 3.1,
      "height_m": 12.0,
      "seasonal": false,
      "evergreen": true,
      "stages": ["sapling", "mature"],
      "resource_tags": ["perch", "shelter", "shrub_thicket", "nest_cup"],
      "biomass_kg_per_crown_m2": null,
      "community_weight": {"saopaulo-br": 1.0},
      "native_status": {"saopaulo-br": "Introduced"},
      "invasive": false,
      "range": null,
      "external": {},
      "stand_in_for": "Cryptomeria japonica",
      "provenance": {
        "sources": [
          {
            "url": "https://en.wikipedia.org/wiki/Cryptomeria_japonica",
            "title": "Wikipedia contributors, \"Cryptomeria japonica\", English Wikipedia, CC BY-SA 4.0",
            "license": "CC-BY-SA-4.0",
            "accessed": "2026-10-01"
          },
          {
            "url": "https://github.com/jt55401/speeeecies/blob/main/schema/v0.1/flora-taxa.json",
            "title": "speeeecies contributors, schema/v0.1/flora-taxa.json (drawable plant models), CC BY-SA 4.0",
            "license": "CC-BY-SA-4.0",
            "accessed": "2026-10-01"
          }
        ],
        "confidence": "Low",
        "derived": true,
        "note": "Juniperus virginiana (eastern redcedar) is the drawable stand-in for Cryptomeria japonica (Japanese cedar / cedro-japones), the narrow columnar evergreen conifer planted throughout Sao Paulo state, native to Japan. Both are tall, slim, columnar conifers, so this is the closest drawable model for it. The other obvious Sao Paulo garden conifer, Podocarpus retrophyllus, has no openly licensed species article and so is named in flora_wishlist instead of catalogued here. Growth form, evergreen flag, height_m and crown_width_m are the stand-in model's, from schema/v0.1/flora-taxa.json, so placement matches what is drawn. native_status follows the Wikipedia article on Cryptomeria japonica. community_weight is judgement: a relative share of 1.0 among the garden's trees, divided by the importer's 0.3 multiplier for Introduced plants. resource_tags are judgement, chosen to match the perch and shelter resources the garden's birds and marmosets ask for."
      }
    },
    {
      "taxon": "Thuja occidentalis",
      "common_name": "cipreste",
      "family": "Cupressaceae",
      "archetype": "Excurrent",
      "crown_width_m": 4.0,
      "height_m": 15.0,
      "seasonal": false,
      "evergreen": true,
      "stages": ["sapling", "mature"],
      "resource_tags": ["perch", "shelter", "shrub_thicket"],
      "biomass_kg_per_crown_m2": null,
      "community_weight": {"saopaulo-br": 2.0},
      "native_status": {"saopaulo-br": "Introduced"},
      "invasive": false,
      "range": null,
      "external": {},
      "stand_in_for": "Cupressus lusitanica",
      "provenance": {
        "sources": [
          {
            "url": "https://en.wikipedia.org/wiki/Cupressus_lusitanica",
            "title": "Wikipedia contributors, \"Cupressus lusitanica\", English Wikipedia, CC BY-SA 4.0",
            "license": "CC-BY-SA-4.0",
            "accessed": "2026-10-01"
          },
          {
            "url": "https://github.com/jt55401/speeeecies/blob/main/schema/v0.1/flora-taxa.json",
            "title": "speeeecies contributors, schema/v0.1/flora-taxa.json (drawable plant models), CC BY-SA 4.0",
            "license": "CC-BY-SA-4.0",
            "accessed": "2026-10-01"
          }
        ],
        "confidence": "Low",
        "derived": true,
        "note": "Thuja occidentalis (northern white-cedar) is the drawable stand-in for Cupressus lusitanica (cipreste), the clipped evergreen conifer hedge standard in Sao Paulo gardens, native to the Iberian Peninsula. Growth form, evergreen flag, height_m and crown_width_m are the stand-in model's, from schema/v0.1/flora-taxa.json, so placement matches what is drawn. native_status follows the Wikipedia article on Cupressus lusitanica. community_weight is judgement: a relative share of 0.6 among the garden's trees, divided by the importer's 0.3 multiplier for Introduced plants. resource_tags are judgement, chosen to give the garden's birds a hedge to perch and shelter in."
      }
    },
    {
      "taxon": "Ilex opaca",
      "common_name": "camélia",
      "family": "Aquifoliaceae",
      "archetype": "Decurrent",
      "crown_width_m": 10.2,
      "height_m": 12.0,
      "seasonal": false,
      "evergreen": true,
      "stages": ["sapling", "mature"],
      "resource_tags": ["nectar", "fruit", "perch", "shrub_thicket", "shelter", "nest_cup"],
      "biomass_kg_per_crown_m2": null,
      "community_weight": {"saopaulo-br": 2.0},
      "native_status": {"saopaulo-br": "Introduced"},
      "invasive": false,
      "range": null,
      "external": {},
      "stand_in_for": "Camellia japonica",
      "provenance": {
        "sources": [
          {
            "url": "https://en.wikipedia.org/wiki/Camellia_japonica",
            "title": "Wikipedia contributors, \"Camellia japonica\", English Wikipedia, CC BY-SA 4.0",
            "license": "CC-BY-SA-4.0",
            "accessed": "2026-10-01"
          },
          {
            "url": "https://github.com/jt55401/speeeecies/blob/main/schema/v0.1/flora-taxa.json",
            "title": "speeeecies contributors, schema/v0.1/flora-taxa.json (drawable plant models), CC BY-SA 4.0",
            "license": "CC-BY-SA-4.0",
            "accessed": "2026-10-01"
          }
        ],
        "confidence": "Low",
        "derived": true,
        "note": "Ilex opaca (American holly) is the drawable stand-in for Camellia japonica (camélia), the evergreen glossy-leaved shrub-tree that is the standard hedge and understorey plant of shaded Sao Paulo courtyards, native to East Asia. Growth form, evergreen flag, height_m and crown_width_m are the stand-in model's, from schema/v0.1/flora-taxa.json, so placement matches what is drawn. native_status follows the Wikipedia article on Camellia japonica. community_weight is judgement: a relative share of 0.6 among the garden's trees, divided by the importer's 0.3 multiplier for Introduced plants. resource_tags are judgement, chosen to give the thrush and the tanager the fruit and nectar both garden birds ask for."
      }
    },
    {
      "taxon": "Magnolia grandiflora",
      "common_name": "magnólia",
      "family": "Magnoliaceae",
      "archetype": "Decurrent",
      "crown_width_m": 20.3,
      "height_m": 25.0,
      "seasonal": false,
      "evergreen": true,
      "stages": ["sapling", "mature"],
      "resource_tags": ["nectar", "perch", "shelter", "leaf_litter", "nest_platform"],
      "biomass_kg_per_crown_m2": null,
      "community_weight": {"saopaulo-br": 0.67},
      "native_status": {"saopaulo-br": "Introduced"},
      "invasive": false,
      "range": null,
      "external": {},
      "stand_in_for": "Michelia champaca",
      "provenance": {
        "sources": [
          {
            "url": "https://en.wikipedia.org/wiki/Michelia_champaca",
            "title": "Wikipedia contributors, \"Michelia champaca\", English Wikipedia, CC BY-SA 4.0",
            "license": "CC-BY-SA-4.0",
            "accessed": "2026-10-01"
          },
          {
            "url": "https://github.com/jt55401/speeeecies/blob/main/schema/v0.1/flora-taxa.json",
            "title": "speeeecies contributors, schema/v0.1/flora-taxa.json (drawable plant models), CC BY-SA 4.0",
            "license": "CC-BY-SA-4.0",
            "accessed": "2026-10-01"
          }
        ],
        "confidence": "Low",
        "derived": true,